{
  "schemaId": "https://schemas.repo-template.dev/adoption-shell-v2/capability-bundle.schema.json",
  "schemaVersion": "2.0.0",
  "schemaDigest": "956cbe96172c5067e2e67327e63c0ea88542983991c595ad489e5413c6a42dd0",
  "contractId": "repo-template/adoption-shell-v2",
  "digestAlgorithm": "sha256-rfc8785-v1",
  "bundles": [
    {
      "id": "repo-template/local-ci-contract-v2",
      "version": "2.0.0",
      "dependencies": [],
      "artifacts": [
        "artifacts/adoption-shell-v2/local-ci-contract-v2.d.ts",
        "artifacts/adoption-shell-v2/local-ci-contract-v2.js",
        "contracts/local-ci/v2/local-ci-contract-v2.schema.json"
      ],
      "fixtures": [
        "contracts/local-ci/v2/fixtures/invalid-duplicate-command-id.json",
        "contracts/local-ci/v2/fixtures/invalid-extra-effect.json",
        "contracts/local-ci/v2/fixtures/invalid-incomplete-env.json",
        "contracts/local-ci/v2/fixtures/invalid-malformed.json",
        "contracts/local-ci/v2/fixtures/invalid-missing-field.json",
        "contracts/local-ci/v2/fixtures/invalid-no-authoritative-gate.json",
        "contracts/local-ci/v2/fixtures/invalid-unsupported-version.json",
        "contracts/local-ci/v2/fixtures/legacy-invalid-v1.json",
        "contracts/local-ci/v2/fixtures/legacy-model-gateway-v1.json",
        "contracts/local-ci/v2/fixtures/legacy-repo-factory-v1.json",
        "contracts/local-ci/v2/fixtures/valid-local-ci-v2.json"
      ],
      "goldens": [],
      "modes": [
        {
          "id": "validate",
          "entrypoint": "artifacts/adoption-shell-v2/local-ci-contract-v2.js",
          "requiredPaths": [
            "artifacts/adoption-shell-v2/local-ci-contract-v2.d.ts",
            "artifacts/adoption-shell-v2/local-ci-contract-v2.js",
            "contracts/local-ci/v2/fixtures/invalid-duplicate-command-id.json",
            "contracts/local-ci/v2/fixtures/invalid-extra-effect.json",
            "contracts/local-ci/v2/fixtures/invalid-incomplete-env.json",
            "contracts/local-ci/v2/fixtures/invalid-malformed.json",
            "contracts/local-ci/v2/fixtures/invalid-missing-field.json",
            "contracts/local-ci/v2/fixtures/invalid-no-authoritative-gate.json",
            "contracts/local-ci/v2/fixtures/invalid-unsupported-version.json",
            "contracts/local-ci/v2/fixtures/legacy-invalid-v1.json",
            "contracts/local-ci/v2/fixtures/legacy-model-gateway-v1.json",
            "contracts/local-ci/v2/fixtures/legacy-repo-factory-v1.json",
            "contracts/local-ci/v2/fixtures/valid-local-ci-v2.json",
            "contracts/local-ci/v2/local-ci-contract-v2.schema.json"
          ]
        }
      ],
      "digestAlgorithm": "sha256-rfc8785-v1",
      "digest": "12e6604b74413263039d55b4705e4d0e1cc3b854d7aead900d91cd9cef093e60"
    },
    {
      "id": "repo-template/local-ci-contract-v3",
      "version": "3.0.0",
      "dependencies": [
        {
          "id": "repo-template/local-ci-contract-v2",
          "version": "2.0.0",
          "digest": "12e6604b74413263039d55b4705e4d0e1cc3b854d7aead900d91cd9cef093e60"
        }
      ],
      "artifacts": [
        "artifacts/adoption-shell-v2/local-ci-contract-v3.d.ts",
        "artifacts/adoption-shell-v2/local-ci-contract-v3.js",
        "artifacts/adoption-shell-v2/local-ci-outcome-v1.d.ts",
        "artifacts/adoption-shell-v2/local-ci-outcome-v1.js",
        "contracts/local-ci/v3/local-ci-contract-v3.schema.json",
        "contracts/local-ci/v3/local-ci-outcome-v1.schema.json"
      ],
      "fixtures": [
        "contracts/local-ci/v3/fixtures/invalid-detection-proof-conflict.json",
        "contracts/local-ci/v3/fixtures/invalid-detection-proof-empty-exempt.json",
        "contracts/local-ci/v3/fixtures/invalid-duplicate-command-id.json",
        "contracts/local-ci/v3/fixtures/invalid-extra-effect.json",
        "contracts/local-ci/v3/fixtures/invalid-incomplete-env.json",
        "contracts/local-ci/v3/fixtures/invalid-malformed.json",
        "contracts/local-ci/v3/fixtures/invalid-missing-detection-proof.json",
        "contracts/local-ci/v3/fixtures/invalid-missing-field.json",
        "contracts/local-ci/v3/fixtures/invalid-no-authoritative-gate.json",
        "contracts/local-ci/v3/fixtures/invalid-unsupported-version.json",
        "contracts/local-ci/v3/fixtures/legacy-local-ci-v2.json",
        "contracts/local-ci/v3/fixtures/valid-local-ci-v3.json"
      ],
      "goldens": [],
      "modes": [
        {
          "id": "validate",
          "entrypoint": "artifacts/adoption-shell-v2/local-ci-contract-v3.js",
          "requiredPaths": [
            "artifacts/adoption-shell-v2/local-ci-contract-v3.d.ts",
            "artifacts/adoption-shell-v2/local-ci-contract-v3.js",
            "artifacts/adoption-shell-v2/local-ci-outcome-v1.d.ts",
            "artifacts/adoption-shell-v2/local-ci-outcome-v1.js",
            "contracts/local-ci/v3/fixtures/invalid-detection-proof-conflict.json",
            "contracts/local-ci/v3/fixtures/invalid-detection-proof-empty-exempt.json",
            "contracts/local-ci/v3/fixtures/invalid-duplicate-command-id.json",
            "contracts/local-ci/v3/fixtures/invalid-extra-effect.json",
            "contracts/local-ci/v3/fixtures/invalid-incomplete-env.json",
            "contracts/local-ci/v3/fixtures/invalid-malformed.json",
            "contracts/local-ci/v3/fixtures/invalid-missing-detection-proof.json",
            "contracts/local-ci/v3/fixtures/invalid-missing-field.json",
            "contracts/local-ci/v3/fixtures/invalid-no-authoritative-gate.json",
            "contracts/local-ci/v3/fixtures/invalid-unsupported-version.json",
            "contracts/local-ci/v3/fixtures/legacy-local-ci-v2.json",
            "contracts/local-ci/v3/fixtures/valid-local-ci-v3.json",
            "contracts/local-ci/v3/local-ci-contract-v3.schema.json",
            "contracts/local-ci/v3/local-ci-outcome-v1.schema.json"
          ]
        }
      ],
      "digestAlgorithm": "sha256-rfc8785-v1",
      "digest": "88b0d1f44eac757962de977f4c58682f546f31d2065f113ab001e50cf53b343d"
    },
    {
      "id": "repo-template/product-registry-overlays",
      "version": "1.0.0",
      "dependencies": [],
      "artifacts": [
        "component-registry.overlay.yaml",
        "contracts/overlays/v1/component-registry.overlay.schema.json",
        "contracts/overlays/v1/product-overlay.schema.json",
        "contracts/overlays/v1/technology-registry.overlay.schema.json",
        "docs/adr/0011-product-and-registry-overlays-with-immutable-provenance.md",
        "product-overlay.yaml",
        "technology-registry.overlay.yaml"
      ],
      "fixtures": [
        "contracts/overlays/v1/fixtures/invalid-dormant-no-trigger.yaml",
        "contracts/overlays/v1/fixtures/invalid-mutable-provenance.yaml",
        "contracts/overlays/v1/fixtures/invalid-role.yaml",
        "contracts/overlays/v1/fixtures/valid-component-registry.overlay.yaml",
        "contracts/overlays/v1/fixtures/valid-product-overlay.yaml",
        "contracts/overlays/v1/fixtures/valid-technology-registry.overlay.yaml"
      ],
      "goldens": [],
      "modes": [],
      "digestAlgorithm": "sha256-rfc8785-v1",
      "digest": "811b9e1af1bfbab7f276ee045dc2fd0288f1336d7cea18eb0fb4e1d049966bbd"
    },
    {
      "id": "repo-template/proof-of-detection",
      "version": "1.0.0",
      "dependencies": [
        {
          "id": "repo-template/local-ci-contract-v3",
          "version": "3.0.0",
          "digest": "88b0d1f44eac757962de977f4c58682f546f31d2065f113ab001e50cf53b343d"
        }
      ],
      "artifacts": [
        ".runtime-artifact-registry.json",
        ".runtime-artifact-registry.schema.json",
        "scripts/check-runtime-artifact-registry.ts",
        "scripts/proof-of-detection/reference-detectors/fixtures/dark-hex.css",
        "scripts/proof-of-detection/reference-detectors/fixtures/dark-rgb.css",
        "scripts/proof-of-detection/reference-detectors/fixtures/light.css",
        "scripts/proof-of-detection/reference-detectors/theme-dual-mode-lint.ts",
        "scripts/proof-of-detection/run-meta-gate.ts"
      ],
      "fixtures": [],
      "goldens": [],
      "modes": [
        {
          "id": "self-test",
          "entrypoint": "scripts/proof-of-detection/run-meta-gate.ts",
          "requiredPaths": [
            ".runtime-artifact-registry.json",
            ".runtime-artifact-registry.schema.json",
            "scripts/check-runtime-artifact-registry.ts",
            "scripts/proof-of-detection/reference-detectors/fixtures/dark-hex.css",
            "scripts/proof-of-detection/reference-detectors/fixtures/dark-rgb.css",
            "scripts/proof-of-detection/reference-detectors/fixtures/light.css",
            "scripts/proof-of-detection/reference-detectors/theme-dual-mode-lint.ts",
            "scripts/proof-of-detection/run-meta-gate.ts"
          ]
        }
      ],
      "digestAlgorithm": "sha256-rfc8785-v1",
      "digest": "69d8f6c55dbee595c2f4907085d478d2531091b37d726ef4670462c2642ee95f"
    },
    {
      "id": "repo-template/quality-lint",
      "version": "1.1.0",
      "dependencies": [],
      "artifacts": [
        "docs/QUALITY-LINT.md",
        "eslint.config.ts",
        "local-ci.json",
        "scripts/verify-quality-lint-required.ts"
      ],
      "fixtures": [],
      "goldens": [],
      "modes": [
        {
          "id": "config",
          "entrypoint": "eslint.config.ts",
          "requiredPaths": [
            "docs/QUALITY-LINT.md",
            "eslint.config.ts",
            "local-ci.json",
            "scripts/verify-quality-lint-required.ts"
          ]
        },
        {
          "id": "presence",
          "entrypoint": "scripts/verify-quality-lint-required.ts",
          "requiredPaths": [
            "eslint.config.ts",
            "scripts/verify-quality-lint-required.ts"
          ]
        }
      ],
      "digestAlgorithm": "sha256-rfc8785-v1",